{"task":"4e.1","verdict":"rework","findings":[
{"id":"U1-1","severity":"Medium","affects":"contract","summary":"Task 4d.6 can turn a retried answer into a refusal. It refuses any reply_to sent while the latest run is terminal. ADR 0023 risk 9 forbids a retried answer becoming a refusal or a second input, and the ADR puts the answer replay check (3) after the ownership and reply_to checks. A first answer that finishes the run, then retried, would hit the new terminal branch. The task adds only two tests and neither covers the retry. It also does not say that idempotency record lookup (0) and the replay check run before the new branch. It also leaves 'no latest run with reply_to' unspecified. Check (2) already gives NOT_FOUND for a reply_to naming no run of the conversation, so that case never reaches the router.","evidence":"docs/plans/2026-10-20-phase4-conversation-chat.md:646-664 (4d.6); docs/adr/0023-conversation-model.md:55 (order of checks) and plan line 106 (risk 9)"},
{"id":"U1-2","severity":"Medium","affects":"contract","summary":"G-B approval is not recorded where the task contract requires it, and the brief now contradicts the plan. The brief's Approval section still says 'Pending' and its Decisions section still asks the owner for answers. The plan says G-B is approved and the approval is recorded 'in the 4e.1 handoff', but no 4e.1 handoff exists in docs/handoffs. The acceptance step 'approval recorded verbatim' is therefore met only by the plan. 4e.2 builds from the brief, which still reads as unapproved. Related: the owner's words 'advisor can decide all on behalf me' delegate the eight decisions to the advisor. One of them, decision 3, amends an accepted ADR (0023 §4) and adds a kernel task (4d.6). The ADR amendment is not owner-confirmed. The delegation needs to be stated as such, and the ADR 0023 §4 amendment should be flagged for explicit owner sign-off when 4d.6 lands.","evidence":"research/20-conversation-thread-brief.md:209-224; docs/plans/2026-10-20-phase4-conversation-chat.md:685-694; harness/state/4/tasks/4e.1.json acceptance; ls docs/handoffs (no 4e.1 entry)"},
{"id":"U1-3","severity":"Low","affects":"style","summary":"Plan wording: decision 3 'closes the open question in ADR 0023 §4', but §4 states the start route for an ended run. It is a settled rule being changed, not an open question. Say 'amends'.","evidence":"docs/plans/2026-10-20-phase4-conversation-chat.md:688; docs/adr/0023-conversation-model.md:48"},
{"id":"U1-4","severity":"Low","affects":"style","summary":"Brief: the 'waiting approval with a refused message' row and decision 4 describe a server refusal. In `shadow` a message during approval starts a separate unlinked run (ADR 0023 §9) and is not refused. The brief should state that the per-run fallback keeps the composer locked, as it is today, so the typed text is not silently posted.","evidence":"research/20-conversation-thread-brief.md:44,63,68,202; docs/adr/0023-conversation-model.md:146"},
{"id":"U1-5","severity":"Low","affects":"style","summary":"Audit: F-7 cites RunStatus.tsx:28 for the class assignment, but the className line is 26. The screenshots cited as evidence (audit/shots/*.png) are not committed and cannot be re-checked. The audit says so, but a short description of each capture would make the findings reproducible.","evidence":"docs/reviews/2026-10-21-chat-surface-gap-audit.md:20,237; ui/packages/components/src/features/composer/RunStatus.tsx:26"},
{"id":"U1-6","severity":"Low","affects":"style","summary":"The contract lists research/README.md in allowed_paths, but harness/context.toml protects research/** (create-only), so that step cannot be done. The report states this and the file was left untouched, which is correct. The contract's path list or the plan should record that the index line is deferred, and the index also lacks an entry for research 17.","evidence":"harness/state/4/tasks/4e.1.json allowed_paths; task-4e.1-report.md 'Blocked'"}
],
"reviewer":{"provider":"claude","fresh_context":true}}
