{
  "task": "4b.3",
  "verdict": "accept",
  "findings": [
    {
      "id": "R1-1",
      "severity": "Low",
      "affects": "style",
      "summary": "The chip text follows the lead-in 'Your message text, plus:', which promises a list; 'plus: Uses this conversation...' reads awkwardly. The brief fixes the wording; carried to the 4b.4 UX review and G-0.",
      "evidence": "ui/packages/components/src/features/composer/ContextPreview.tsx:45-57; ui/packages/ui-core/src/i18n.ts:205, :214"
    },
    {
      "id": "R1-2",
      "severity": "Low",
      "affects": "style",
      "summary": "The Playwright title still says 'sends no page context'; it asserts a test id only.",
      "evidence": "ui/packages/ui-conformance/tests/composer.spec.ts:23"
    },
    {
      "id": "R1-3",
      "severity": "Low",
      "affects": "style",
      "summary": "The VI text is natural and matches the EN meaning; the owner confirms it at G-0.",
      "evidence": "ui/packages/ui-core/src/i18n.ts:483"
    }
  ],
  "reviewer": {
    "provider": "claude-sonnet",
    "fresh_context": true
  }
}
