{
  "task": "4b.1",
  "verdict": "accept",
  "findings": [
    {
      "id": "R1-1",
      "severity": "Low",
      "affects": "style",
      "summary": "The reference-vanilla UI prints item.detail raw, so a legacy row reads 'unknown \u2192 RUNNING' untranslated; consistent with its raw state names, no undefined.",
      "evidence": "ui/apps/reference-vanilla/src/main.ts:163"
    },
    {
      "id": "R1-2",
      "severity": "Low",
      "affects": "style",
      "summary": "legacyTransition treats empty or non-string values as absent, stricter than the brief; the 'unknown' literal is shared with the i18n key suffix.",
      "evidence": "ui/packages/ui-core/src/store.ts:157-160"
    }
  ],
  "reviewer": {
    "provider": "claude-sonnet",
    "fresh_context": true
  }
}
