{
  "task": "1d.6",
  "verdict": "accept",
  "findings": [
    {
      "id": "R-1",
      "severity": "Low",
      "affects": "style",
      "summary": "An empty --profile now falls back to E_AGENT_PROFILE without saying so; before the change an empty path failed. Testing `path is None` instead of truthiness would refuse the empty string.",
      "evidence": "src/e_agent/server/profile.py:107 `path = path or os.environ.get(\"E_AGENT_PROFILE\")`; scripts/dev/serve.py:27"
    },
    {
      "id": "R-2",
      "severity": "Low",
      "affects": "style",
      "summary": "README and the runbook export a relative E_AGENT_PROFILE; from any other directory every profile-loading command fails with a FileNotFoundError traceback.",
      "evidence": "README.md:108, docs/runbooks/demo.md:9; src/e_agent/server/profile.py:112; ENG-DOC-1"
    },
    {
      "id": "R-3",
      "severity": "Low",
      "affects": "style",
      "summary": "The implicit-default scan matches only the literal `load_profile()`; load_profile(None) and CLI invocations without --profile are outside it (checked by hand: all callers pass a profile). It scans 183 files at HEAD; the handoff said 184.",
      "evidence": "tests/unit/server/test_profile_location.py:14"
    },
    {
      "id": "R-4",
      "severity": "Low",
      "affects": "style",
      "summary": "The red run was an ImportError at collection, not the behavioural red the plan expected; test_load_profile_requires_path_or_env never ran against the old default (it would have failed).",
      "evidence": "harness/state/1/handoffs/1d.6.json; plan Task 1d.6 step 2; ENG-WORK-2"
    },
    {
      "id": "R-5",
      "severity": "Low",
      "affects": "style",
      "summary": "Running scripts/dev/serve.py directly, without make, used to start on the packaged fixture profile and now fails with STARTUP_REJECTED; the documented make targets always export E_AGENT_DEV_PROFILE. Handoff ruling 3 does not mention this.",
      "evidence": "scripts/dev/serve.py:27-28; Makefile:12"
    }
  ],
  "reviewer": {
    "provider": "claude",
    "fresh_context": true
  }
}
