{"task": "4.R3", "verdict": "accept", "findings": [{"id": "R3-1", "severity": "Low", "affects": "style", "summary": "SUCCEEDED with reason `answered` counts as verified, because the line reuses `resultStatusKey`. `answered` is the kernel's text-reply end (`run_loop.py:235`). It has no independent read-back of its own, so an inner step's VERIFIED outcome could carry a 'verified' line on a run whose badge already says 'Completed · verified'. This is pre-existing badge behaviour: the line never disagrees with the badge, and `grounded` is handled correctly with the 'grounded, not verified' label. If the owner wants `answered` to be non-verified, change `resultStatusKey` once and the line follows. Not a regression from this task.", "evidence": "ui/packages/ui-core/src/presentation.ts:51; ui/packages/ui-core/src/selectors/thread.ts:97-99; src/e_agent/kernel/run_loop.py:235"}, {"id": "R3-2", "severity": "Low", "affects": "style", "summary": "The implementer's concern about a short gap in B-1 is acceptable. The case is a refusal whose own follow-up read already shows the run has left the refusing state. The hint is then stale from its first paint and clears on the next state change, run change or send. Cause: `refusalCause` is recorded after the refusal's own `refresh()`, which keeps a stale pre-refusal view from clearing a valid hint (covered by a test). The gap is short and self-healing, and the draft is untouched. The alternative, branching on the server's hint text, would be worse. BUSY also clears on any state change of its run, including RUNNING to WAITING_APPROVAL. Clearing early is safe, and a fresh send gets a fresh hint.", "evidence": "ui/packages/ui-core/src/controller.ts:222-238, 428-432"}], "reviewer": {"provider": "claude", "fresh_context": true}}
