{
  "task": "H.1",
  "verdict": "accept",
  "findings": [
    {
      "id": "R-1",
      "severity": "Low",
      "affects": "style",
      "summary": "close-check reports the contract stale (rules.md, principles.md, plan changed after the digest) and no handoff yet; run refresh-task and write the handoff before closing. Expected process step, not a defect in the diff.",
      "evidence": "uv run e-agent-harness close-check: 'contract is stale: authoritative files changed'; ENG-EVID-1"
    },
    {
      "id": "R-2",
      "severity": "Low",
      "affects": "style",
      "summary": "The three flagged choices are sound: the silent-pass list as a sub-list under ENG-EVID-4 is finite and its first entries match the brief; keeping PR-31 in the backlog, retargeted to H.4, is correct because TASKS is undelivered; PR-31 stays [Pa] for the same reason.",
      "evidence": "docs/design/principles.md:77 and the PR-31 backlog row; .agents/skills/eng-foundations/references/rules.md ENG-EVID-4"
    },
    {
      "id": "R-3",
      "severity": "Low",
      "affects": "style",
      "summary": "On zero cases main() still writes the empty report JSON before exiting 1. Acceptable (count printed, exit 1); noted so H.4/H.5 do not copy the write-then-fail order for scans.",
      "evidence": "scripts/release_report.py main(), summarize()"
    }
  ],
  "reviewer": {"provider": "claude", "fresh_context": true}
}
